Stoppinochos|De todo el gobierno, PSOE y afines el que mayor credibilidad tiene actualmente es Victor de Aldama , todo lo que él explicó se va cumpliendo, sin embargo lo que explica el gobierno y portavoces ocurre todo lo contrario, se está demostrando que mienten.
Fasfas|El gobierno no para de cruzar líneas rojas. Lo de la fontanera buscando trapos sucios. Ayer otra línea roja nueva, al negarse formalmente a rectificar el bulo, la falsedad, la falacia, la mentira difundida por tres ministros de que el capitán Bonilla había amenazado con poner una bomba lapa al presidente. Es intolerable.
ADELE_|@tienesrazon #326 Cerrar ¿Pero creéis que es normal que el felón esté huido desde ni se sabe cuantos días con el circo mundial que hay montado en España para tapar su corrupción?. Increíble, más indecente es imposible ser, normal que hasta Page pida elecciones generales. No hombre, lo normal es que seis meses después Mazón todavía no se haya reunido con las víctimas de la Dana. El PP asesina y después amordaza.
maqqabi|@Utopilitologo #229 Cerrar "El Libro gordo del Ppetete" Un romance desde las cloacas de Génova. Prólogo de Marcial Dorado. Editorial Barcenas. Número 1 en ventas. Rrecuerde que el prólogo y el capítulo del génesis de las cloacas del Estado lo firman Barrionuevo, Vera, Amedo y Domínguez. Nada, simplemente es para situarle de dónde arranca la historia del inframundo estatal. Ah, sí, lo mismo que la Biblia se la dictó Dios en persona a Moisés (según la más antigua tradición bíblico-judaica), hubo un ser superior, llamado X, que se la dictó a esos cuatro. Luego tenemos a los evangelistas del "cloaquismo" todos sabemos que han Sido Pérez Rubalcaba, Rodríguez Zapatero, Pepe Blanco y el nuevo aprendiz, Gracita Bolaños.
Lhalo|Esto si es FANGO enbesrado puro, del Gobierno y del PSOE.
ErPere|@masmas #320 Cerrar @ andres72 # 176 siente pena por tu mismo que crees las mentiras que suelta Aldama con tal de librarse de la cárcel solo porque vienen bien a los de tu cuerda Ya te digo que eso no funciona así, tu puedes confesar lo que quieras, pero si no demuestras con pruebas lo que estás diciendo, no hay trato con la fiscalía. Ya han salido mil cosas, quien sabe si Aldama ha colaborado para que salgan esas cosas, ya el PSOE intentó desacreditar a este individuo con lo de la TIA y el colega ni corto ni perezoso enseño sus fotos reunido con agentes del FBI... Los fiscales no son tontos, si han hecho un trato con Aldama es porque pueden conseguir encarcelar a muchos otros chorizos, yo estoy a favor de eso y tu?
EL_AVISPERO|Sigue habiendo borregos votando al PPSOE, Rajoy nos metió en este lío y Sánchez lo está rematando, pero a los peperos se les acaba de ocurrir que lo mejor es que esto lo arregle otro Rajoy ahora llamado Feijoo y después vendrá otro socialista peor que Sánchez y Zapatero, esto es como el día de la marmota y yo con 30 años pensando en largarme de este país porque tengo claro que no voy a estar 50 años pagando una hipoteca y todavía ahorrando para la entrada.
alataquel|@ADELE_ #152 Cerrar @ AdPS # 107 Pues si me la cierran me abriré otra. Pero conseguirá así usted que los franquistas de Vox entren en el gobierno, o que el inútil de Feijóo gane unas elecciones? Eh, no. Escúcheme: no. Otra vez, para dejarlo claro: que no. . Como siempre y ante la falta de argumentos, mintiendo y por los "Cerros de Úbeda", en lo que respecta a la noticia de que se trata. El que tiene que ganar alguna vez unas elecciones, es Narciso. Así por lo menos y para ser presidente, no se tendría que juntar con los asesinos de sus "compañeros" de partido y más de ochocientas personas. Más los miles de millones de euros que está costando a los trabajadores españoles vía impuestos para que Narciso pueda asegurarse la presidencia. PP 137 escaños psoe 121. ¿Quién ganó las elecciones Clo -Ti?. Ahora va Leire, la "fontanera", y se da de baja del psoe, Gallardo, el presidente de la Diputación de Badajoz, o sea, el que colocó al hermano de Narciso se afora......¿Por qué será?. El psoe está de mird hasta la coronilla. ¡ Viva la regeneración democrática!. Mic - mic.
tienesrazon|@masmas #292 Cerrar @ marcameron # 203 no te enteras cuñao, si estaba previsto que le pudieran preguntar, pero Aldama ha cortado la declaración Halaaaaaa, jajajaja, pero que pedazo de mentiroso eres, jope con los rojos, mentís más que respiráis, era una rueda de prensa sin preguntas, una declaración y punto. ¿Pero por qué mentís tanto tío?, increíble.
ADELE_|ÚLTIMA HORA El forero unoquepasTaba publica su nuevo libro, "Mi retraso extremo". De regalo, un pañal relleno de Nutella.
arknoval|Cuando el Gobierno de España se convierte en una pandilla de macarras padan estas cosas.
ADELE_|@AdPS #291 Cerrar Encuesta de La Razón a los votantes socialistas ... 1/3 de los votantes consideran que el PSOE está detrás de Leyre Díez (2,6 mill votos); el 46% creen que SI se está intentando desacreditar a la UCO (3,6 mill); el 50% considera que el PSOE no está gestionando bien los casos que están saliendo de corrupción (3,9 mill); el 37% piensa que en España hay mayor INSEGURIDAD (3 mill); el 45% opina que los servicios públicos van a peor (3,5 mill) y siguiendo para bingo ... el 82% está convencido de que el tema de la vivienda no mejorará (¡6,4 mill!). Y sreá imposible que esto mejore porque ni nos metemos con las encuestas de valoración de los candidatos/ministros a las autonómicas que ya es para llorar. ¿Seguro que el votante socialista está conforme con el Sr. Sánchez? Porque creo que la abstención al voto al PSOE en las próximas elecciones será apabullante. Encuesta de El Mundo: un 99% de sus lectores piensan que Mazón ahogó erótico y lamentan mucho no haber estado en Valencia aquel día. Morir por el Partido Popular, qué gozada.
tienesrazon|¿Pero creéis que es normal que el felón esté huido desde ni se sabe cuantos días con el circo mundial que hay montado en España para tapar su corrupción?. Increíble, más indecente es imposible ser, normal que hasta Page pida elecciones generales.
Lipglosmulticolor_|El PSOE sanchista y su cambio hacia una mejor democracia y progresista, como así lo disfraza en su relato Sánchez, un gobierno, cuya forma de comportarse y lo llama gobernar y democracia, y que no es ni debería ser s socialmente aceptada por lo que estamos viviendo y cuya perversión política va mucho más allá que la corrupción institutonacionalizada.
ADELE_|@AdPS #294 Cerrar @ ADELE_ # 231 Si, y hay un okupa en Moncloa que está pagada con el dinero de los contribuyentes. mismos delincuentes Vale, pero deje de llamar a Tejero "Mi erótico novio". Intente ser mas demócrata.
masmas|@JohnM #174 Cerrar El PSOE toma a los ciudadanos por idiotas. Normal, porque está acostumbrado a dirigirse a sus votantes. que va, sus votantes les castigan y cambian el voto, los idiotas son los del PP que les votan hagan lo que hagan, hasta cuando los pillan con las manos en la masa repartiendo sobres de dinero
albertgirona|Buenas tardes... Estamos asistiendo a la Descomposición absoluta de un Gobierno absorbido por las Cloacas que montaron para desprestigiar a todo kiski ... Ni en las Peores Dictaduras del Mundo se han visto espectaculos Circenses, Esperpénticos y Turbios, como los que día si y día también, estamos contemplando... que tiren ya la cisterna del wáter, y se larguen todos, pandilla de impresentables
ADELE_|@Viano43 #295 Cerrar @ ADELE_ # 231 cuando nos vais a invitar a una habitación en teruel pagada con dinero público??? Ah que eso solo lo hacen los rojos con dinero público Y cuándo nos van a ahogar? Ah que eso solo lo hace el PP en Valencia, menos mal.
masmas|@andres72 #176 Cerrar Vivimos en un país donde Aldama tiene mas credibilidad que Sanchez, Ortiz (fiscal general) o Pumpido (presidente del Tribunal Constitucional). Siento verguenza de mi Gobierno, y siento verguenza de la parte de mi país que lo apoya. siente pena por tu mismo que crees las mentiras que suelta Aldama con tal de librarse de la cárcel solo porque vienen bien a los de tu cuerda
masmas|@jrafael #180 Cerrar Alguna vez los socialistas responden a las preguntas que se les formulan, nunca responden, siempre se van por los cerros de Úbeda. que preguntas?, que no han respondido?, como os gusta inventaros bulos
masmas|@JohnGallagher #182 Cerrar Señores del ejército. Es ahora o nunca. Es el momento. Ustedes tienen armamento, munición, y disciplina militar. Pongan orden. Hagan limpieza. No miren atrás. empezarían con gente como usted
Srama|Cada vez veo más incompatible mi vida en España con la presencia de un partido tan sucio y corrosivo como el Psoe. Harto de sus mentiras, manipulación, culto al caudillo, desprecio a los ciudadanos, incumplimientos legales, agresión a la justicia, corrupción a raudales....
Manu-el|4 meses esperando que estos sinvergüenzas de este diario me devuelvan una suscripción cobrada ilegalmente y sin avisar. Espero que perdáis muchos suscriptores por la forma que actuais y la desconsideracion que tenéis por los suscriptores.
Manu-el|4 meses esperando que estos sinvergüenzas de este diario me devuelvan una suscripción cobrada ilegalmente y sin avisar. Espero que perdáis muchos suscriptores por la forma que actuais y la desconsideracion que tenéis por los suscriptores.
masmas|@tienesrazon #190 Cerrar @ andres72 # 176 Lo has clavado y es que es una realidad tangible. Recuerdo que cuando empezó lo de Aldama, cuando salió de la cárcel me refiero, que hicieron varias encuestas y casi el 80% creían a Aldama antes que a Sánchez, incluidos por supuesto muchos votantes del PSOE. Si hicieran ahora una encuesta seguro que ese porcentaje ha aumentado. El problema es que a muchos de los que saben que Sánchez miente no les importa, por ejemplo a los foreros rojos de aquí. así nos va, le dais credibilidad a un chorizo que acabara en la cárcel solo por interés para criticar al gobierno que no es de vuestra cuerda, lamentable
WILLY_NILLY|@ADELE_ #159 Cerrar @ WILLY_NILLY # 121 Bueno, y seis meses después Mazón todavía no se ha reunido con los familiares de sus 228 víctimas. Oye, él a su ritmo, no lo agobies. Anda!! Otra vez sin hacer los deberes, Adelita??? Ayer te dije que escribieras en la pizarra :Mazón, Mazón, Mazón,Mazón, Mazón, Mazón,Mazón, Mazón, Mazón,Mazón, Mazón, Mazón, Mazón, Mazón, Mazón...Sigues sin aprender nada, MAL, muy mal Adelita,muy mal...
masmas|@Adelita_rada #192 Cerrar Ah bueno. Pues asunto zanjado, no? Si lo dice ella y su sanchidad dice que no la conoce, pues nada, habra que creerles. tienes pruebas de lo contrario?
andres72|@ADELE_ #231 Cerrar @ Zark_7 # 228 ¡Desde luego! Lo lógico sería votar al PP, el partido cuya sede está pagada con dinero negro. Ya lo dijo el demócrata Vargas Llosa, se vota mal. Es Ferraz a donde llevan dinero negro, de 90.000 en 90.000 por lo visto. Y eso sin contar el dinero de los traficantes de droga libaneses a los que ayudan desde el PSOE canario.
AdPS|@Segistobre #233 Cerrar El gran momento del trimestre será ver a Feijóo abrazando al Sobremesas Mazón el domingo en la concentración PPera. Pues haz una foto con la captura de pantalla y te la pones con un marco en tu mesilla de noche ... vaya manera de defender algo tan absurda que tienes hijo
ErPere|@tienesrazon #208 Cerrar @ jrafael # 180 Tienes toda la razón, habría que legislar para obligar a los políticos a responder sobre lo que les preguntan y si no sanción, pero sanciones muy duras, primero económicas, después administrativas y finalmente penales si reincidían. Que mientan lo que quieran, pero si les preguntan por manzanas responden por las manzanas, si por peras responden por las peras. Y éso tanto en el Congreso ante los diputados como en las ruedas de prensa en el Congreso ante los periodistas. Ya está bien de la falta de respeto a todos los españoles, porque es a todos, que somos los que escuchamos y tenemos derecho a saber, no es solo a periodistas y diputados. No entiendo como alguien te ha puesto un negativo por decir esto... De verdad es que no quieren democracia, están tan adoctrinados que por defender al Autócrata ya ni quieren oir explicaciones de los políticos.
river|Si es tan inocente de las acusaciones ¿Porqué dimite como militantes? La credibilidad de esta señora actualmente es cero patatero, ya puede decir lo que le dé la gana.
masmas|@uno_que_pasaba #183 Cerrar @ ADELE_ # 159 y no son sus víctimas, lo son de la derogación del plan hidrológico nacional y no limpiar el cauce de los barrancos. eso fue culpa de Rajoy
Ylaverdad|Igual alguien esperaba que la sicaria dijera, "uy me habéis pillao! Efectivamente PS es un súper capo mafioso!"
ADELE_|@Adelita_rada #256 Cerrar @ ADELE_ # 152 Esta claro, meteis a alguien en Correos, tu sustituta, teneis a Indra bajo control. Magefesa se va s manifestar porque haceis competencia ilicita fabricando pucherazos. Pero no, te cuesta entenderlo, pero las ultimas elecciones las gano el PP. Pregunta al portero del club donde trabajas, ese sabe mas numeros que tu. "Numeros" y "tu" mejor con tilde. Qué burros son los voxeros, no le parece?
ADELE_|@Adelita_rada #257 Cerrar No se si os habeis dado cuenta, pero la fontanera adele_ire se ha cambiado la peluca de plumas de gallina por otra, asi espera pasar desapercibida ¿Es la misma peluca que llevaba la Coquitona, a la que expulsaron violentamente del foro? ¿O la que se puso el novio ladrón de Ayuso para declarar? Misterio.
ADELE_|@ElNolano #276 Cerrar @ ADELE_ # 159 Que lástima, señora. Apenas hace un año parecía tan lista, es un decir. La edad no perdona. Lo sé. Bueno, si se consuela usted así de que los franquistas de Vox no pisen moqueta, me parece bien.
Alain_Petit|y Caradehogaza insistiendo en el bulo de la bomba lapa desde la sede gubernamental. Es todo tan increible...
Manu-el|Sánchez tiene la culpa que el diario EL MUNDO no me devuelva una suscrpcion.Estafadores e impresentables los de este periódico. Devolver importe de una suscripción Llevo 3 meses esperando. Que sepan los lectores de este periódico como tratan a sus suscriptores y lectores.
Manu-el|Sánchez tiene la culpa que el diario EL MUNDO no me devuelva una suscrpcion.Estafadores e impresentables los de este periódico. Devolver importe de una suscripción Llevo 3 meses esperando. Que sepan los lectores de este periódico como tratan a sus suscriptores y lectores.
masmas|@maaypi #194 Cerrar @ ADELE_ # 152 Vuelve a errar el tiro... Feijoó si gana elecciones... El que las pierde siempre y sólo gobierna por otras circunstancias es el otro, el suyo. usted también erra erra el tiro, ya que si, Feijoo gano las ultimas, pero no tenia apoyos para gobernar, pero las anteriores las gano Sánchez, no es como usted indica
JLuis_VF|El problema no es la responsabilidad del PSOE. El problema es la responsabilidad de los sinvergüenzas de este gobierno. Eso sí, formado su mayor parte por los peores toreros del PSOE. Lastima de un gran partido.
masmas|@AdPS #196 Cerrar @ Stopfascismo # 154 Eso es lo que pasa cuando sólo te dedicas a leer panfletos sectarios sin contrastar más ... anda porras como está pasando últimamente con demasiados medios afines al mentalista Doctor (ejem) Sánchez, publicando A LO LOCO. A lo mejor el problema es sólo tuyo por no tener una visión más amplia de lo que sucede en el mundo. blablabla, pero no contestas a lo que pregunta el otro usuario, simplemente porque no lo sabes, criticáis porque lo ha dicho vuestro amo y no sabéis porque, lamentable
Ylaverdad|Es obvio que el que le suspendan ahora de militancia debería afectar cero a estas pesquisas sobre la trama PS.
Viano43|@ADELE_ #231 Cerrar @ Zark_7 # 228 ¡Desde luego! Lo lógico sería votar al PP, el partido cuya sede está pagada con dinero negro. Ya lo dijo el demócrata Vargas Llosa, se vota mal. cuando nos vais a invitar a una habitación en teruel pagada con dinero público??? Ah que eso solo lo hacen los rojos con dinero público
AdPS|@ADELE_ #231 Cerrar @ Zark_7 # 228 ¡Desde luego! Lo lógico sería votar al PP, el partido cuya sede está pagada con dinero negro. Ya lo dijo el demócrata Vargas Llosa, se vota mal. Si, y hay un okupa en Moncloa que está pagada con el dinero de los contribuyentes. mismos delincuentes
masmas|@Ciertamente_circunspecto #202 Cerrar @ Colectivo # 198 No incluye Ud. en sus cálculos la millonada que le va a pagar el PSOE por comprar su silencio y complicidad. y usted tiene pruebas de ello, venga ya
masmas|@marcameron #203 Cerrar Yo a esta señora le daría toda la credibilidad del mundo si hubiera abierto la posibilidad de responder preguntas de los periodistas. Porque entonces habría aclarado todo. Leer un pasquin y ya, resulta hilarante. no te enteras cuñao, si estaba previsto que le pudieran preguntar, pero Aldama ha cortado la declaración
AdPS|Encuesta de La Razón a los votantes socialistas ... 1​/3 de los votantes consideran que el PSOE está detrás de Leyre Díez (2,6 mill votos); el 46% creen que SI se está intentando desacreditar a la UCO (3,6 mill); el 50% considera que el PSOE no está gestionando bien los casos que están saliendo de corrupción (3,9 mill); el 37% piensa que en España hay mayor INSEGURIDAD (3 mill); el 45% opina que los servicios públicos van a peor (3,5 mill) y siguiendo para bingo ... el 82% está convencido de que el tema de la vivienda no mejorará (¡6,4 mill!). Y sreá imposible que esto mejore porque ni nos metemos con las encuestas de valoración de los candidatos​/ministros a las autonómicas que ya es para llorar. ¿Seguro que el votante socialista está conforme con el Sr. Sánchez? Porque creo que la abstención al voto al PSOE en las próximas elecciones será apabullante.
masmas|@valenciano543 #204 Cerrar Hasta que la gente no empiece a encararse con todos estos sinvergüenzas, y a plantarles cara en las agrupaciones locales y comarcales, el PSOE no caerá. si no ha caído el PP con todas las que ha liado, no cae ninguno
masmas|@veteatomar #207 Cerrar Los pagos que esta fontanera ofrecía , a cambio de tirar de la manta, no eran ni íntimos ni siquiera de tipo personal. Ofrecía,por ejemplo, un cargo en la Dirección General de la Guardia Civil.¿ Puede ofrecer eso una mujer que actúa a título personal? puede ofrecer lo que quiera, otra cosa es que luego sea verdad que lo puede conseguir, anda que no hay gente que va presumiendo de cosas que luego son mentira
ErPere|Tendrían que echarla de Correos, ahí si demostrarían que están en contra de estas corruptelas, pero.... No se atreven. Si le tocan el bolsillo, verás como canta....
Utopilitologo|@tienesmazon #190 Cerrar @ andres72 # 176 Lo has clavado y es que es una realidad tangible. Recuerdo que cuando empezó lo de Aldama, cuando salió de la cárcel me refiero, que hicieron varias encuestas y casi el 80% creían a Aldama antes que a Sánchez, incluidos por supuesto muchos votantes del PSOE. Si hicieran ahora una encuesta seguro que ese porcentaje ha aumentado. El problema es que a muchos de los que saben que Sánchez miente no les importa, por ejemplo a los foreros rojos de aquí. ...Oye, el libro gordo del Ppetete, con su temática de las cloacas de Génova, necesita una foto explícita, de lo soez y grosero. ¿Te parece bien una foto de tu calva? Gracias de antepie, Pelón.
masmas|@radimov #211 Cerrar Ha bueno si lo niega debe ser que todo lo que he visto y escuchado es mentira. y que has visto y escuchado?, no es contradictorio con lo que ha dicho ella
uno_que_pasaba|@ADELE_ #210 Cerrar @ Noticiero # 205 Buena idea la de empezar de cero. El PP ya la está poniendo en práctica en algunas comunidades, como Valencia. mentira.
lukaslukas|@andres72 #176 Cerrar Vivimos en un país donde Aldama tiene mas credibilidad que Sanchez, Ortiz (fiscal general) o Pumpido (presidente del Tribunal Constitucional). Siento verguenza de mi Gobierno, y siento verguenza de la parte de mi país que lo apoya. Solo tiene más credibilidad para el que quiere dársela como El Mundo o la facheris en general, no para el conjunto de la poblacion
kyra66|Bochornoso, de vergüenza ajena y un insulto a la inteligencia de la mayoría de los españoles. Sanchismo en estado puro, amparado en los bulos y el fango que tanto le gusta denunciar, donde la linea a seguir es repetir continuamente una mentira para intentar convertirla en verdad. Tiempo durísimo para la "democracia"? española
Utopilitologo|OJO. Confirman que será Editorial Barcenas y Marcial Dorado quien financien el libro.
muellegonzalez|@Utopilitologo #229 Cerrar "El Libro gordo del Ppetete" Un romance desde las cloacas de Génova. Prólogo de Marcial Dorado. Editorial Barcenas. Número 1 en ventas. Cómo es posible que se ponga en libertad a un personaje como Aldama inmerso en el.proceso de Hidrocarburos, con un pastizal en el extranjero.....y sin aportar ni una sola prueba desde que salio...... GOLPE DE ESTADO Con TOGAS.....
ADELE_|@Colectivo #226 Cerrar Leire Diez, maketa, chula, falofilica, medradora, amenazante,poco agraciada física e intelectualmente, pelota, amiga del dinero, y una vergüenza de mujer y de hija. Ojalá fuese tan agraciada físicamente como tú. ¿Te siguen llamando "La cosa" en el barrio?
yugurtungue|Ayer en el programa de Risto en TV, Pérez Dolset afirmó que lleva 6 años trabajando con Leire Díez. Es decir, que mientras era alto cargo de empresas públicas esta señora ya estaba trabajando de fontanera.
Piwi-Lin|Un circo, esto es un circo.
Pratchett|El libro se lo va a escribir la que ha arruinado la Casa Árabe? La tal Irene Lozano?
ElNolano|@ADELE_ #159 Cerrar @ WILLY_NILLY # 121 Bueno, y seis meses después Mazón todavía no se ha reunido con los familiares de sus 228 víctimas. Oye, él a su ritmo, no lo agobies. Que lástima, señora. Apenas hace un año parecía tan lista, es un decir. La edad no perdona. Lo sé.
AntiCataloide|@VkUcrania #153 Cerrar El socialismo esta podrido... pleonasmo y antinomia. No existe in PSOE no podrido que se pueda podrir porque nació podrido como el Comunismo y otras formas de Totalitarismo
Decentro|Hechos , el ministro de interior rajoy está imputado por las cloacas del estado y su número 2 arrestado a parte d imputado.
Bavor|Yo tengo unas preguntitas: ¿De qué vive esa Sra.?¿Cotiza a la S.S., y en tal caso quién paga esa cotización? Empecemos por ahí
Guderian|@valenciano543 #204 Cerrar Hasta que la gente no empiece a encararse con todos estos sinvergüenzas, y a plantarles cara en las agrupaciones locales y comarcales, el PSOE no caerá. Pero si el sociaterío está encantado. Con tal de que no gobierne la derecha están dispuestos a lo que sea. Y si no tienen nada que alegar, pues hacen como el grupito de mutilados intelectuales que siempre defienden al PSOE por aquí y sacan sus tres palabras mágicas: Franco, Ayuso y Mazón. Eso para ellos es el bálsamo de Fierabrás que limpia todas las corruptelas del PSOE.
chusita444|porque el sanchez y el psoe no aceptan preguntas ????? les da miedo ?????
uno_que_pasaba|@Stopfascismo #154 Cerrar Pero q se supone ha hecho esta señora y cual se supone es la corrupción sanchista?. Por cierto como va el tema judicial de las residencias de Madrid?... No leo noticias por aquí. Y ya ha dado Ayuso explicaciones de quien ha pagado el aticazo en el q vive?.. no tiene que dar explicaciones de ningún aticazo, mermi, no ¿Das tú explicaciones del chavolazo en el que vives, pides explicaciones de los chanchullos de la PSOE o te limitas al y tú más de toda la vida?
Tresforcas|Que va a decir si la han pillado con las manos en la masa.?
ADELE_|@AmadoGranell #212 Cerrar @ chilper463274_24 # 199 En una democracia parlamentaria gana aquel que logra articular una mayoría para formar Gobierno, no la lista más votada. Pero cree usted que la ardilla Chilper no sabía ya lo que le está contando? Las ardillas son astutas.
valle77|La impunidad jactanciosa de esta casta política se filtra a toda la sociedad y la carcome por dentro. Hay q sacarse a estos inútiles de encima y restablecer la ley igual para todos.
Jivino|Un libro ??? De recetas de pollo, patatas, pastas.... ajajaja pero esto que tomadura de pelo es ... lamentablemente
uno_que_pasaba|@Stopfascismo #154 Cerrar Pero q se supone ha hecho esta señora y cual se supone es la corrupción sanchista?. Por cierto como va el tema judicial de las residencias de Madrid?... No leo noticias por aquí. Y ya ha dado Ayuso explicaciones de quien ha pagado el aticazo en el q vive?.. ¿De verdad se te tiene que explicar, otra vez? Y va cómo tiene que ir.
ADELE_|@Sealord #189 Cerrar @ ADELE_ # 157 La fontanera del PSOE, el Fresita, buscando a su padre, a ver quién de los 2.000 socialistas se la tiró cuando limpiaba los WC de Ferraz. @Sealord #186 Cerrar Ya está por aquí el Fresita, ahora se llama Adele, cuando se la meten le duele. Todavía no ha encontrado a su padre. Pues no, jamás se escribió un comentario más picante que el @ADELE_ #157 Cerrar @ Sealord # 130 Bueno, tú sí has encontrado el tuyo: actúa todas las noches en una sala de fiestas bajo el nombre de "La Julandra". ¿Es muy masculino? Pues hombre, no. .
Supersurco|Es demasiado insultante la huida hacia delante, la cárcel se le queda pequeña a este Gobierno tan delincuente
tienesrazon|Hasta Page ha pedido elecciones generales, el espectáculo bochornoso que estamos viviendo para tapar la corrupción de Sánchez solo les parece bien a gente degenerada como los foreros rojos de aquí, que bueno, el 80% son trabajadores de Ferraz, así que es normal que defiendan la corrupción de su jefe.
i-luso|seguid votando basura,..ya parece que os gusta vivir entre las piaras....
